{
  "schema_version": "aiqa.report.v2",
  "generated_at": "2026-09-01T00:00:00Z",
  "tool": {"name": "aiqa", "version": "fixture", "go_version": "go1.27"},
  "config": {
    "tests": ["compat"],
    "targets": [
      {"id": "openai", "protocol": "openai", "base_url": "https://example.test/openai/v1"},
      {"id": "anthropic", "protocol": "anthropic", "base_url": "https://example.test/anthropic", "api_version": "2023-06-01"}
    ],
    "timeout": "30s",
    "formats": ["json", "markdown"],
    "fail_on": "core",
    "guidance": "full"
  },
  "targets": [
    {
      "id": "openai",
      "protocol": "openai",
      "profile": {"id":"openai-compat","revision":"2026-09-01","source":"https://github.com/openai/openai-openapi","source_commit":"690521b1753dce0c6d6b275f583d22537679cff9","scope":"OpenAI fixture"},
      "discovery": {"model_count":0},
      "models": [],
      "requirements": [],
      "summary": {
        "pass":0,"fail":0,"warn":0,"unsupported":0,"skip":0,"error":0,"required_pass":0,"required_fail":0,"status":"pass",
        "assessment": {
          "verdict":"pass","verdict_reason":"all_applicable_requirements_passed",
          "core":{"total":0,"pass":0,"fail":0,"warn":0,"skip":0,"error":0,"percent":null},
          "optional":{"total":0,"pass":0,"fail":0,"warn":0,"skip":0,"error":0,"percent":null},
          "evidence":{"total":0,"executed":0,"conclusive":0,"execution_percent":null,"conclusive_percent":null},
          "comparison":{"policy":"verdict-core-optional-evidence/v1","rankable":true,"verdict_rank":3}
        }
      },
      "guidance": {"schema_version":"aiqa.guidance.v1","status":"complete","engine":{},"summary":{},"findings":[],"recommendations":[]},
      "rate_limit": {"successful_requests":0,"rate_limited_responses":0,"retries_recovered":0,"backoff_ms":0,"observed_safe_requests_per_second":0,"observed_safe_concurrency":0,"latency_samples":0,"mean_latency_ms":0,"p50_latency_ms":0,"p95_latency_ms":0}
    },
    {
      "id": "anthropic",
      "protocol": "anthropic",
      "profile": {"id":"anthropic-messages-compat","revision":"2026-09-01","source":"https://github.com/anthropics/anthropic-sdk-go","source_commit":"d19dea9ed85bbb5fdb2d6f20fb6f903920ed23fa","scope":"Anthropic Messages fixture","protocol":"anthropic","api_version":"2023-06-01"},
      "discovery": {"model_count":0},
      "models": [],
      "requirements": [],
      "summary": {
        "pass":0,"fail":0,"warn":0,"unsupported":0,"skip":0,"error":0,"required_pass":0,"required_fail":0,"status":"pass",
        "assessment": {
          "verdict":"pass","verdict_reason":"all_applicable_requirements_passed",
          "core":{"total":0,"pass":0,"fail":0,"warn":0,"skip":0,"error":0,"percent":null},
          "optional":{"total":0,"pass":0,"fail":0,"warn":0,"skip":0,"error":0,"percent":null},
          "evidence":{"total":0,"executed":0,"conclusive":0,"execution_percent":null,"conclusive_percent":null},
          "comparison":{"policy":"verdict-core-optional-evidence/v1","rankable":true,"verdict_rank":3}
        }
      },
      "guidance": {"schema_version":"aiqa.guidance.v1","status":"complete","engine":{},"summary":{},"findings":[],"recommendations":[]},
      "rate_limit": {"successful_requests":0,"rate_limited_responses":0,"retries_recovered":0,"backoff_ms":0,"observed_safe_requests_per_second":0,"observed_safe_concurrency":0,"latency_samples":0,"mean_latency_ms":0,"p50_latency_ms":0,"p95_latency_ms":0}
    }
  ],
  "summary": {"verdict":"pass","verdict_reason":"all_targets_passed","target_counts":{"pass":2}}
}
